[
  {
    "id": "b57e6a33b69af0cc2964e24c66981f0746cbcc9f8a89d48a71add7bf748c6bc8",
    "source_url": "https://earthquake.phivolcs.dost.gov.ph/2026_Earthquake_Information/October/2026_1022_0333_B1.html",
    "fetched_at": "2026-10-22T09:36:29.052Z",
    "datetime_pst": "2026-10-22T11:33:00+08:00",
    "datetime_utc": "2026-10-22T03:33:00.000Z",
    "lat": 12.51,
    "lon": 123.77,
    "coordinate_source": "bulletin",
    "location_description": "004 km N 21° E of San Fernando (Masbate)",
    "nearest_town": "San Fernando",
    "nearest_province": "Masbate",
    "depth_km": 31,
    "magnitude": 2,
    "magnitude_type": "Ms",
    "origin_type": "TECTONIC",
    "reported_intensities": null,
    "expecting_damage": false,
    "expecting_aftershocks": false,
    "issued_on_pst": "2026-10-22T11:43:00+08:00",
    "distance_from_cebu_km": 244,
    "within_watch_radius": true,
    "parse_confidence": "high",
    "parse_notes": null
  },
  {
    "id": "443499fc4e77ccc00a6c85c96ad83a961054dc598e42e9b16929c56dbd27ff31",
    "source_url": "https://earthquake.phivolcs.dost.gov.ph/2026_Earthquake_Information/October/2026_1022_0036_B1F.html",
    "fetched_at": "2026-10-22T09:36:29.052Z",
    "datetime_pst": "2026-10-22T08:36:48+08:00",
    "datetime_utc": "2026-10-22T00:36:48.000Z",
    "lat": 10.85,
    "lon": 123.73,
    "coordinate_source": "bulletin",
    "location_description": "015 km N 80° W of Tabuelan (Cebu)",
    "nearest_town": "Tabuelan",
    "nearest_province": "Cebu",
    "depth_km": 30,
    "magnitude": 1.4,
    "magnitude_type": "Ms",
    "origin_type": "TECTONIC",
    "reported_intensities": "This is an aftershock of the 2025 September 30 Mw6.9 Offshore Northern Cebu earthquake.",
    "expecting_damage": false,
    "expecting_aftershocks": false,
    "issued_on_pst": "2026-10-22T08:48:00+08:00",
    "distance_from_cebu_km": 62,
    "within_watch_radius": true,
    "parse_confidence": "high",
    "parse_notes": null
  },
  {
    "id": "d3fa478bebbf7e6dcb7e243ad5731a75470c4e88cfb6e65245a5967fb76c0175",
    "source_url": "https://earthquake.phivolcs.dost.gov.ph/2026_Earthquake_Information/October/2026_1021_1705_B1.html",
    "fetched_at": "2026-10-22T09:36:29.052Z",
    "datetime_pst": "2026-10-22T01:05:10+08:00",
    "datetime_utc": "2026-10-21T17:05:10.000Z",
    "lat": 11.53,
    "lon": 125.31,
    "coordinate_source": "bulletin",
    "location_description": "016 km S 57° W of City Of Borongan (Eastern Samar)",
    "nearest_town": "City Of Borongan",
    "nearest_province": "Eastern Samar",
    "depth_km": 26,
    "magnitude": 2.3,
    "magnitude_type": "Ms",
    "origin_type": "TECTONIC",
    "reported_intensities": null,
    "expecting_damage": false,
    "expecting_aftershocks": false,
    "issued_on_pst": "2026-10-22T01:10:00+08:00",
    "distance_from_cebu_km": 206,
    "within_watch_radius": true,
    "parse_confidence": "high",
    "parse_notes": null
  },
  {
    "id": "9043013a6826b7f0e65fb60fe00a638b02494e10c13db346f144227007f4d940",
    "source_url": "https://earthquake.phivolcs.dost.gov.ph/2026_Earthquake_Information/October/2026_1021_1626_B1.html",
    "fetched_at": "2026-10-22T09:36:29.052Z",
    "datetime_pst": "2026-10-22T00:26:14+08:00",
    "datetime_utc": "2026-10-21T16:26:14.000Z",
    "lat": 9.59,
    "lon": 125.4,
    "coordinate_source": "bulletin",
    "location_description": "003 km S 08° W of Malimono (Surigao Del Norte)",
    "nearest_town": "Malimono",
    "nearest_province": "Surigao Del Norte",
    "depth_km": 3,
    "magnitude": 3.1,
    "magnitude_type": "Ms",
    "origin_type": "TECTONIC",
    "reported_intensities": null,
    "expecting_damage": false,
    "expecting_aftershocks": false,
    "issued_on_pst": "2026-10-22T00:32:00+08:00",
    "distance_from_cebu_km": 184,
    "within_watch_radius": true,
    "parse_confidence": "high",
    "parse_notes": null
  }
]
